8fca4759,Up to 20% off Men's & Women's Fashion from Amazon Brands,10.3,59.8,0,0,https://www.amazon.com/deal/8fca4759,Best Deal,29 day(s) 18 hour(s) 35 minute(s) 58 second(s)
df53ce45,"TOLOCO Massage Gun, Upgrade Percussion Muscle Massage Gun for Athletes, Handheld Deep Tissue Massager Gun (Black)",0,0,15,93.49,https://www.amazon.com/deal/df53ce45,Best Deal,6 day(s) 18 hour(s) 20 minute(s) 59 second(s)
fbc9e30b,"Mounting Dream UL Listed TV Mount for Most 37-70 Inch TV, Universal Tilt TV Wall Mount Fit 16"", 18"", 24"" Stud with Loading 132 lbs & Max VESA 600x400mm, Low Profile Flat Wall Mount Bracket MD2268-LK",0,0,37,21.41,https://www.amazon.com/deal/fbc9e30b,Best Deal,6 day(s) 18 hour(s) 20 minute(s) 59 second(s)
8b2d12da,"Up to 30% off Fitbit Luxe, Sense, Charge 5 & More",39.95,199.95,0,0,https://www.amazon.com/deal/8b2d12da,Best Deal,5 day(s) 18 hour(s) 35 minute(s) 58 second(s)
6cf33631,"Tkisko Native 1080P HD Projector, 5G WiFi Bluetooth 4K-Supported Video Projector, 360 ANSI LM 9500lm Movie Projector, ±50° 4D Keystone Correction, 50% Zoom, Compatible with Phone, Laptop, PS4, Switch",0,0,61,213.85,https://www.amazon.com/deal/6cf33631,Lightning Deal,11 hour(s) 5 minute(s) 59 second(s)
fe939bae,Save on select digital EA titles for Xbox Series X|S and Xbox One,18,50,0,0,https://www.amazon.com/deal/fe939bae,Best Deal,6 day(s) 18 hour(s) 35 minute(s) 59 second(s)
847b8a86,Trucker Bluetooth Headset 5.0 with Microphone Noise Cancelling Wireless Phone Headset 22Hrs Talktime Mute Button for Cell Phones Laptop Office Home Online Class PC Call Center Skype,0,0,42,28.89,https://www.amazon.com/deal/847b8a86,Best Deal,6 day(s) 18 hour(s) 20 minute(s) 59 second(s)
bef7130c,Up to 38% off on Medify Air Purifiers,59.99,476,0,0,https://www.amazon.com/deal/bef7130c,Best Deal,5 day(s) 18 hour(s) 35 minute(s) 58 second(s)
958af4e8,"FANGTIAN N95 Mask NIOSH Certified Particulate Respirators Protective Face Mask (Pack of 10, Model FT-N040 / Approval Number TC-84A-7861)",0,0,58,11,https://www.amazon.com/deal/958af4e8,Best Deal,6 day(s) 18 hour(s) 20 minute(s) 59 second(s)
f98e5445,"Lunix LX5 4pcs Orthopedic Bed Wedge Pillow Set, Post Surgery Memory Foam for Back, Neck and Leg Pain Relief. Sitting Pillow, Comfortable and Adjustable Pillows Acid Reflux and GERD for Sleeping Brown",0,0,15,169.97,https://www.amazon.com/deal/f98e5445,Best Deal,6 day(s) 18 hour(s) 20 minute(s) 59 second(s)
fd65df91,CARDYDONY Women's Long Cardigan Open Front Color Block Cardigan Knit Sweaters,20.99,29.74,0,0,https://www.amazon.com/deal/fd65df91,Lightning Deal,11 hour(s) 5 minute(s) 59 second(s)
d025fe16,"Dreametech T10 Cordless Vacuum Cleaner, Long Runtime, 20Kpa Powerful Suction Stick Vacuum Cleaner, 8-Layer Noise Reduction Handheld Vacuum for Home Hard Floor Pet Hair",0,0,29,254.99,https://www.amazon.com/deal/d025fe16,Best Deal,6 day(s) 18 hour(s) 20 minute(s) 59 second(s)
69987ca9,Save up to 33% on TurboTax Deluxe 2021 Deluxe + State,0,0,33,39.99,https://www.amazon.com/deal/69987ca9,Best Deal,33 day(s) 18 hour(s) 20 minute(s) 59 second(s)
b48d23b9,"Antree Pasta Maker Attachment 3 in 1 Set for KitchenAid Stand Mixers Included Pasta Sheet Roller, Spaghetti Cutter, Fettuccine Cutter Maker Accessories and Cleaning Brush",0,0,15,81.58,https://www.amazon.com/deal/b48d23b9,Best Deal,6 day(s) 18 hour(s) 20 minute(s) 59 second(s)
192a2576,Extra Large 52L Travel Laptop Backpack with USB Charging Port Fit 17 Inch Laptops for Men Women,0,0,28,32.99,https://www.amazon.com/deal/192a2576,Best Deal,6 day(s) 18 hour(s) 20 minute(s) 59 second(s)
b6dbd6ec,Up to 32% off Bissell Floorcare and Air Purifiers,0,0,32,159.99,https://www.amazon.com/deal/b6dbd6ec,Best Deal,32 day(s) 18 hour(s) 35 minute(s) 58 second(s)
7d116cc3,PET N PET Dog Poop Bag USDA Certified 38% Biobased Poop Bags 1080 Counts 60 Rolls 9x13 Inches Dog Bags for Poop,0,0,25,18.69,https://www.amazon.com/deal/7d116cc3,Best Deal,6 day(s) 18 hour(s) 20 minute(s) 59 second(s)
837406b7,Zeagoo Women's Floral Print Loose Casual Flowy Tunic Tank Top,8.48,13.99,0,0,https://www.amazon.com/deal/837406b7,Lightning Deal,10 hour(s) 40 minute(s) 59 second(s)
02e17d4a,Parent Hand Massager,0,0,31,110.47,https://www.amazon.com/deal/02e17d4a,Best Deal,6 day(s) 18 hour(s) 20 minute(s) 59 second(s)
c4492c0d,Save 15% Off on Select Chemical Guys Car Wash Kits and Accessories,3.96,254.99,0,0,https://www.amazon.com/deal/c4492c0d,Best Deal,21 day(s) 18 hour(s) 35 minute(s) 58 second(s)
1c339eaf,Save on DEWALT 20V Batteries & Tools,99,131.16,0,0,https://www.amazon.com/deal/1c339eaf,Best Deal,9 day(s) 18 hour(s) 35 minute(s) 58 second(s)
65139e61,Up to 15% on Moen Kitchen and Bathroom Fixtures,2.11,1029.31,0,0,https://www.amazon.com/deal/65139e61,Best Deal,12 day(s) 18 hour(s) 35 minute(s) 58 second(s)
d26972b5,Up to 19% off Heat Storm HS-1500 Infrared Wall Mount Heater ,0,0,19,104.99,https://www.amazon.com/deal/d26972b5,Best Deal,11 day(s) 18 hour(s) 35 minute(s) 58 second(s)
4781bd0d,Up to 29% off Instant Pot Kitchen Appliances and Coffee Makers,79.95,119.95,0,0,https://www.amazon.com/deal/4781bd0d,Best Deal,12 day(s) 18 hour(s) 35 minute(s) 58 second(s)
7af77805,20% off Breville Juicers & Bluicers,79.95,319.95,0,0,https://www.amazon.com/deal/7af77805,Best Deal,7 day(s) 18 hour(s) 35 minute(s) 58 second(s)
0382b2ff,Up to 23% off on Hoover & Oreck Floorcare Products,89,299,0,0,https://www.amazon.com/deal/0382b2ff,Best Deal,5 day(s) 18 hour(s) 35 minute(s) 58 second(s)
fe338c83,Up to 30% off Health Care products by Amazon Basic Care,3.86,18.97,0,0,https://www.amazon.com/deal/fe338c83,Best Deal,5 day(s) 18 hour(s) 35 minute(s) 58 second(s)
bdab6b50,"FANGTIAN N95 Respirator NIOSH Certified N95 Particulate Respirators Face Mask (Pack of 20, Size M/L, Model FT-N058 / Approval Number TC-84A-7863)",0,0,15,25.45,https://www.amazon.com/deal/bdab6b50,Best Deal,6 day(s) 18 hour(s) 20 minute(s) 59 second(s)
de6d4bb5,Save up to 39% on TurboTax Premier 2021 with State for PC,0,0,39,54.99,https://www.amazon.com/deal/de6d4bb5,Best Deal,33 day(s) 18 hour(s) 20 minute(s) 59 second(s)
c7638c5e,COLWOD ReManufactured 63xl Ink Cartridge Replacement for HP 63 63XL use with HP OfficeJet 5255 3830 4650 5258 3832 HP DeskJet 2132 3630 3636 HP Envy 4525 4528(1 Black + 1 Tri-Color),0,0,17,32.99,https://www.amazon.com/deal/c7638c5e,Best Deal,6 day(s) 18 hour(s) 20 minute(s) 59 second(s)
8fca4759,Up to 20% off Men's & Women's Fashion from Amazon Brands,10.3,59.8,0,0,https://www.amazon.com/deal/8fca4759,Best Deal,29 day(s) 18 hour(s) 35 minute(s) 35 second(s)
808d9215,"Comfier Shiatsu Neck & Back Massager with Heat, Massagers for Neck and Back Deep Tissue,Adjustable Shiatsu Nodes,Full Body Massage Chair Pad for Office,Home,Gifts for Mom,Dad",0,0,8,117.29,https://www.amazon.com/deal/808d9215,Lightning Deal,11 hour(s) 30 minute(s) 36 second(s)
1e2127de,YALOX Water Shoes Women's Men's Outdoor Beach Swimming Aqua Socks Quick-Dry Barefoot Shoes Surfing Yoga Pool Exercise,6.69,12.64,0,0,https://www.amazon.com/deal/1e2127de,Lightning Deal,11 hour(s) 30 minute(s) 36 second(s)
6ae46436,"Topsung Walkie Talkies for Adult, Easy to Use Rechargeable Long Range Walky Talky Handheld Two Way Radio with NOAA for Hiking Camping 920",0,0,29,33.99,https://www.amazon.com/deal/6ae46436,Lightning Deal,11 hour(s) 50 minute(s) 36 second(s)
a0789822,"femometer Touchless Thermometer for Adults and Kids, Non Contact Digital Thermometer for Fever, Forehead Thermometer for Home and Family, Black",0,0,43,16.99,https://www.amazon.com/deal/a0789822,Best Deal,6 day(s) 18 hour(s) 20 minute(s) 36 second(s)
600810e7,"KOMSURF Indoor Cycling Stationary Bike, Exercise Bike for Home Cardio Gym, Belt Drive Workout Bike with Ipad Mount & Comfortable Seat Cushion & LCD Monitor, 330 LBS Weight Capacity",0,0,6,169.98,https://www.amazon.com/deal/600810e7,Lightning Deal,11 hour(s) 30 minute(s) 36 second(s)
472db320,"Zhiyun Crane M3 Handheld 3-Axis Stabilizer, Gimbal Stabilizer for Mirrorless Camera, Gopro, Smartphone",313.65,551.65,0,0,https://www.amazon.com/deal/472db320,Lightning Deal,11 hour(s) 30 minute(s) 36 second(s)
064fb327,Women's Waterproof Ski Jacket Fleece Windproof Mountain Winter Snow Jacket Warm Outdoor Sports Rain Coat with Removable Hood,0,0,41,47.59,https://www.amazon.com/deal/064fb327,Lightning Deal,11 hour(s) 40 minute(s) 36 second(s)
c2a2e861,"Mobile Pixels Duex Lite Duex Pro Portable Monitor, The On-The-Go Dual-Screen Laptop Monitor, 12.5"" Full HD IPS Display, USB A/Type-C, Plug and Play, Sleek Design",29.74,254.99,0,0,https://www.amazon.com/deal/c2a2e861,Lightning Deal,11 hour(s) 40 minute(s) 36 second(s)
ec2f8fa1,Richave Fleece Blankets Queen Size for All Season 350GSM - Premium Lightweight Anti-Static Throw for Bed Extra Soft Brush Fabric Warm Sofa Thermal Blanket,12.66,36.54,0,0,https://www.amazon.com/deal/ec2f8fa1,Lightning Deal,11 hour(s) 35 minute(s) 36 second(s)
b3cabdcb,"Native 1080P 5G WiFi Bluetooth Projector, AILESSOM 9800LM 450"" Display Support 4K Movie Projector, High Brightness for Home Theater and Business, Compatible with iOS/Android/TV Stick/PS4/HDMI/USB/PPT",0,0,15,314.48,https://www.amazon.com/deal/b3cabdcb,Lightning Deal,11 hour(s) 35 minute(s) 36 second(s)
4ab52a01,Sidefeel Women Open Front Cardigan Sweater Button Down Knit Sweater Coat X-Large Burgundy,0,0,24,32.28,https://www.amazon.com/deal/4ab52a01,Lightning Deal,11 hour(s) 50 minute(s) 36 second(s)
40f3ffa9,"softan Flannel Sheet Set, Deep Pocket Double Brushed Micro Fleece 4 Pcs, Easy Care and Super Soft Flannel Sheets Queen for Winter (White)",13.59,50.99,0,0,https://www.amazon.com/deal/40f3ffa9,Lightning Deal,11 hour(s) 55 minute(s) 36 second(s)
1090910f,"AirPods Pro Leather Case, MAOGOMA Genuine Premium Vintage Oil Wax Crazy Horse Cowhide Leather Case Cover for Airpods Pro, Handcrafted Fully-Wrapped, The Front LED Visible, Dark Brown",28.04,31.44,0,0,https://www.amazon.com/deal/1090910f,Lightning Deal,11 hour(s) 50 minute(s) 36 second(s)
d6e27233,"Milestar Big Pop Puzzle Game Fidget Jigsaw Toys Popper Push Pop Bubble Silicone Sensory Fidget Toy Parent-Child Toys,Play Toys with Friends for Autism Needs Pressure Relieving as The Best Gift",0,0,30,13.99,https://www.amazon.com/deal/d6e27233,Lightning Deal,11 hour(s) 50 minute(s) 36 second(s)
e8dba96e,"Wireless Gaming Headset for PS4/PS5/PC, 2.4GHz Ultra-Low Latency, Hi-Fi Lossless Sound Quality Gaming Headsets, Wireless Gaming Headphones with Noise Cancelling Microphone",0,0,38,49.99,https://www.amazon.com/deal/e8dba96e,Lightning Deal,11 hour(s) 35 minute(s) 36 second(s)
101b3157,Asvivid Womens Summer Floral Printed Off The Shoulder Tops 3 4 Flare Sleeve Tie Knot T-Shirt Blouses,0,0,35,19.54,https://www.amazon.com/deal/101b3157,Lightning Deal,11 hour(s) 55 minute(s) 36 second(s)
f38b03c8,"TIPTOE BEAR Duvet Cover Set, 100% Washed Cotton 3 Piece Set with Zipper Closure, Ultra Soft Breathable Chic Bedding, Includes 1 Comforter Cover and 2 Pillow Shams, Queen Size 90""x 90""",47.59,50.99,0,0,https://www.amazon.com/deal/f38b03c8,Lightning Deal,11 hour(s) 45 minute(s) 36 second(s)
105a2847,"AMD Ryzen 7 3750H Processor(up to 4.0GHz) Beelink SER3 Mini PC,16 GB RAM/500 GB M.2 NVME SSD,Windows 10 Pro,Gigabit Ethernet,4K@60hz,Triple Display(Dual HDMI+Type-C),WiFi 5,BT4.0,Support Auto Power On",0,0,15,475.15,https://www.amazon.com/deal/105a2847,Lightning Deal,11 hour(s) 45 minute(s) 36 second(s)
1c4d281f,Car Seat Covers for Women Full Coverage Universal Leather Seat Covers for Cars Trucks SUVs Full Set,0,0,15,169.99,https://www.amazon.com/deal/1c4d281f,Lightning Deal,11 hour(s) 50 minute(s) 36 second(s)
b716b241,Hammam Linen 100% Cotton Hand Towels,12.74,33.99,0,0,https://www.amazon.com/deal/b716b241,Lightning Deal,11 hour(s) 35 minute(s) 36 second(s)
4c79d97a,"McJaw Heated Blanket Low Voltage - 50”×60“ Throw Size Faux Fur Electric Blanket, Embossed Plush Throw Blanket for Couch (50”×60“)",0,0,30,61.6,https://www.amazon.com/deal/4c79d97a,Lightning Deal,11 hour(s) 45 minute(s) 36 second(s)
3d937fbb,AWULIFFAN Women's Fall Long Sleeve V-Neck T-Shirt Sleepwear Tunic Tops Blouse Shirts,14.44,22.09,0,0,https://www.amazon.com/deal/3d937fbb,Lightning Deal,11 hour(s) 20 minute(s) 36 second(s)
ce714aed,DREAM PAIRS Black Lace-up Combat Boots Ankle Booties for Women,0,0,29,38.24,https://www.amazon.com/deal/ce714aed,Lightning Deal,11 hour(s) 30 minute(s) 36 second(s)
757f74c0,PRETTYGARDEN Women's Plaid Shirts Long Sleeve Lapel Button Down Cardigan Color Block Boyfriend Shacket Jacket Coats,17.84,30.59,0,0,https://www.amazon.com/deal/757f74c0,Lightning Deal,11 hour(s) 25 minute(s) 36 second(s)
9dc6e0fb,"10'' Ring Light with 50'' Extendable Tripod Stand, Sensyne LED Circle Lights with Phone Holder for Live Stream/Makeup/YouTube Video/TikTok, Compatible with All Phones.",0,0,39,30.59,https://www.amazon.com/deal/9dc6e0fb,Best Deal,6 day(s) 18 hour(s) 2 minute(s) 19 second(s)
4787d790,CHICZONE Women's Denim Shorts Mid Rise Ripped Jean Shorts Stretchy Folded Hem Hot Short Jeans,21.75,24.3,0,0,https://www.amazon.com/deal/4787d790,Lightning Deal,10 hour(s) 42 minute(s) 19 second(s)
f3375382,"Video Baby Monitor, eufy Security, Video Baby Monitor with Camera and Audio, 720p HD Resolution, Night Vision, 5"" Display, 110° Wide-Angle Lens Included, Lullaby Player, Ideal for New Moms",0,0,24,119,https://www.amazon.com/deal/f3375382,Best Deal,6 day(s) 18 hour(s) 2 minute(s) 19 second(s)
52a1a56f,Nestl Deep Pocket Bed Sheets,16.95,28.95,0,0,https://www.amazon.com/deal/52a1a56f,Lightning Deal,11 hour(s) 52 minute(s) 19 second(s)
e08b4b52,"Mkeke Compatible with iPhone 12 Screen Protector, Tempered Glass Screen Protector for iphone 12 Pro 6.1 inch [3-Pack]",0,0,24,6.79,https://www.amazon.com/deal/e08b4b52,Best Deal,6 day(s) 18 hour(s) 2 minute(s) 19 second(s)
c4250d41,"YnM Bamboo Weighted Blanket — 100% Cooling Bamboo Viscose Oeko-Tex Certified Material with Premium Glass Beads (Sea Grass, 60''x80'' 20lbs), Suit for One Person(~190lb) Use on Queen/King Bed",42.41,186.99,0,0,https://www.amazon.com/deal/c4250d41,Lightning Deal,11 hour(s) 52 minute(s) 19 second(s)
b395cf09,Ultrax Labs Hair Surge | Caffeine Hair Loss Hair Growth Stimulating Shampoo 8 oz,0,0,32,67.95,https://www.amazon.com/deal/b395cf09,Best Deal,6 day(s) 18 hour(s) 2 minute(s) 19 second(s)
9efe96ec,"AUXITO H11 LED Headlight Bulbs 12000lm Per Set 6500K Cool White Wireless H8 H9 Headlight LED Bulb, Pack of 2",0,0,15,33.99,https://www.amazon.com/deal/9efe96ec,Best Deal,6 day(s) 18 hour(s) 2 minute(s) 19 second(s)
63f10dd0,"Handheld USB Digital Microscope with Metal Stand, Portable HD 1000 X Magnification Inspection Camera with 8 LED Light for Android Mac Windows Computer",0,0,40,35.99,https://www.amazon.com/deal/63f10dd0,Lightning Deal,11 hour(s) 47 minute(s) 19 second(s)
c3af8ed0,"Mac Book Pro Charger, 61W USB C Fast Charger Power Adapter for MacBook Pro 13 Inch/12 Inch,for MacBook Air,Included USB-C to USB-C Charge Cable (7.2ft/2.2m)…",0,0,12,24.41,https://www.amazon.com/deal/c3af8ed0,Best Deal,6 day(s) 18 hour(s) 2 minute(s) 6 second(s)
c92be40c,Bigox Face Mask 50Pcs Masks,9.22,14.34,0,0,https://www.amazon.com/deal/c92be40c,Best Deal,6 day(s) 18 hour(s) 2 minute(s) 6 second(s)
cd1c5f4d,"Up to 30% off Watches from Invicta, Timex, Citizen, and more",18.27,488.85,0,0,https://www.amazon.com/deal/cd1c5f4d,Best Deal,37 day(s) 18 hour(s) 17 minute(s) 5 second(s)
7b5e92fc,"Kids Disposable Face Masks, 100 Pack Kids Masks Disposable, Kids Face Mask Childrens Disposable Face Mask (Colorful)",0,0,30,13.99,https://www.amazon.com/deal/7b5e92fc,Best Deal,6 day(s) 17 hour(s) 59 minute(s) 40 second(s)
6ead8e1a,FLOWEROOM Blackout Curtains for Bedroom,17.67,31.44,0,0,https://www.amazon.com/deal/6ead8e1a,Lightning Deal,11 hour(s) 59 minute(s) 40 second(s)
10f6edac,Fitted Sheet - Single Fitted Sheet - Affordable Quality,9.99,21.24,0,0,https://www.amazon.com/deal/10f6edac,Lightning Deal,11 hour(s) 39 minute(s) 33 second(s)
504fb70a,"ONOAYO 5G WiFi Projector 9200L Full HD Native 1920×1080P Bluetooth Mini Projector, Support 4K &Zoom, Full Sealed Optical/LCD/LED/Home/Outdoor Movie Portable Projector for Phone,PC,PS4,TV Stick",0,0,57,186.99,https://www.amazon.com/deal/504fb70a,Lightning Deal,11 hour(s) 24 minute(s) 33 second(s)
72a1787f,BOKT Luxury Crystal Ball Wall Lamp Modern Wall Mounted Light Antique Brass for or Living Room Bathroom Bedroom and Hallway Wall Sconce Lighting,0,0,15,132.59,https://www.amazon.com/deal/72a1787f,Lightning Deal,11 hour(s) 49 minute(s) 33 second(s)
b3977481,"ROQ Silicone Wedding Ring for Women, Affordable Thin Line and Point Stackable Silicone Rubber Wedding Bands, 8, 4 & Single Packs",5.09,11.04,0,0,https://www.amazon.com/deal/b3977481,Lightning Deal,11 hour(s) 44 minute(s) 33 second(s)
52625eb2,"EMUST Reversible Dog Coat, Windproof Waterproof Dog Jacket for Cold Weather, Warm Dog Winter Clothes Apparel for Small Medium Large Dogs",12.74,17.84,0,0,https://www.amazon.com/deal/52625eb2,Lightning Deal,11 hour(s) 54 minute(s) 33 second(s)
567a593d,"Pink Kids Headphones for School,Kids Headphones Headphones for Kids with Volume Limit of 94 db,Wired Children Headphones for Online Learning/School/Travel/Tablet Adjustable Headband Foldable",0,0,40,11.99,https://www.amazon.com/deal/567a593d,Lightning Deal,11 hour(s) 24 minute(s) 33 second(s)
239daa4b,"Divoom Tivoo Retro Bluetooth Speaker - Pixel Art DIY Box, RGB Programmable 16X16 LED, Support Android & iOS; TF/SD Card & AUX 3.9X3X3.3 inches",0,0,27,50.99,https://www.amazon.com/deal/239daa4b,Lightning Deal,11 hour(s) 34 minute(s) 33 second(s)
206e9886,Gaatpot Women's Men's Comfort Lined Clogs Winter Garden Slippers Fleece Lining Slip On Shoes Indoor Outdoor Mules,25.99,29.74,0,0,https://www.amazon.com/deal/206e9886,Lightning Deal,11 hour(s) 34 minute(s) 33 second(s)
0c1dd754,"Timos Dog Collar for Small Medium Large Dogs,Adjustable Soft Puppy Collars with Metal Buckle",8.49,11.89,0,0,https://www.amazon.com/deal/0c1dd754,Lightning Deal,11 hour(s) 24 minute(s) 33 second(s)
713ac7c1,"TAOCOCO Non-Slip Recliner Chair Cover Sofa Slipcover, Pet Cover for Small Recliner Chair with Elastic Straps, Washable Reclining Chair Cover Recliner Furniture Protector",20.39,26.34,0,0,https://www.amazon.com/deal/713ac7c1,Lightning Deal,11 hour(s) 29 minute(s) 33 second(s)
c0f5ef4e,"1080P Webcam with Microphone, Full HD 1080P Computer Webcam for Video Conferencing Online Teaching Live Streaming, Plug and Play, Compatible with Desktop and Laptop",0,0,32,16.99,https://www.amazon.com/deal/c0f5ef4e,Lightning Deal,11 hour(s) 24 minute(s) 33 second(s)
d29ed35f,"ECO WORTHY 10W 12V Solar Panel High Efficiency PV Module Power for Battery, Boat, Gate Opener, Chicken Coop, Off-Grid Applications",20.39,30.59,0,0,https://www.amazon.com/deal/d29ed35f,Lightning Deal,11 hour(s) 44 minute(s) 33 second(s)
64e97326,"GVM 1500D RGB LED Video Light, 75W Video Lighting Kit with Bluetooth Control, 3 Packs Led Panel Light for Photography, YouTube Studio, Video Shooting, Broadcasting, Conference, 1128 Led Beads",0,0,15,662.99,https://www.amazon.com/deal/64e97326,Lightning Deal,11 hour(s) 49 minute(s) 33 second(s)
6517e44b,WenVen Men's Hooded Warm Coat Winter Parka Jacket,63.74,64.59,0,0,https://www.amazon.com/deal/6517e44b,Lightning Deal,11 hour(s) 49 minute(s) 33 second(s)
a3290910,PHF 100% Washed French Flax Linen Duvet Cover Set …,108.79,117.29,0,0,https://www.amazon.com/deal/a3290910,Lightning Deal,11 hour(s) 54 minute(s) 33 second(s)
ba95f8fa,MILESTAR Fidget Toy Luminous pops,9.99,12.74,0,0,https://www.amazon.com/deal/ba95f8fa,Lightning Deal,11 hour(s) 44 minute(s) 33 second(s)
58acc1c1,Sarin Mathews Womens Shirts Off The Shoulder Tops Sexy V Neck Slim Fit Shirts Tops Blouses,16.58,17.84,0,0,https://www.amazon.com/deal/58acc1c1,Lightning Deal,11 hour(s) 34 minute(s) 33 second(s)
ffc818ca,"Ventidora 100% Washed Cotton Sheet 4 Piece Bedding Set,Ultra Soft Breathable 100% Natural Cotton Duvet Cover Set with Corner Ties(1Duvet Cover+1 Flat Sheet+2 Pillowcases)",61.13,76.49,0,0,https://www.amazon.com/deal/ffc818ca,Lightning Deal,11 hour(s) 29 minute(s) 33 second(s)
565fd323,"PLUSHIBLE BRIDGING MILES WITH SMILES Plushable High Heeled Christmas Stockings - Soft and Sturdy Christmas Decorations - Wine Bottle Holder and Festive Wine Decor for The Holidays (Santa's Belt, 1)",8.49,15.29,0,0,https://www.amazon.com/deal/565fd323,Lightning Deal,11 hour(s) 29 minute(s) 33 second(s)
53ea2ed2,"Bellivera Womens Lightweight Puffer Jacket, Winter Coats for Women Warm Quilted Bubble Padded Hood Coat with Faux Fur Collar",44.99,63.74,0,0,https://www.amazon.com/deal/53ea2ed2,Lightning Deal,11 hour(s) 21 minute(s) 58 second(s)
